{
  "@context": "https://cheeleong.dev/troika-system-json/context.jsonld",
  "@id": "https://cheeleong.dev/troika-system-json/objects/items/knife.json",
  "@type": "Item",
  "name": "Knife",
  "description": "A small blade, useful as both tool and weapon. Starting equipment for all characters.",
  "slots": 1,
  "tags": [
    "weapon",
    "melee",
    "tool",
    "starting_equipment"
  ],
  "weapon": {
    "category": "melee",
    "damageAs": "knife",
    "specialRules": [
      "one_handed",
      "melee",
      "tool"
    ]
  },
  "type": "weapon"
}
