{
  "@context": "https://troika-system-json.cheeleong.dev/context.jsonld",
  "@id": "https://troika-system-json.cheeleong.dev/objects/items/flask-of-oil.json",
  "@type": "Item",
  "name": "Flask of Oil",
  "description": "Fuel for lanterns and other purposes. Starting equipment for all characters.",
  "slots": 1,
  "tags": [
    "equipment",
    "fuel",
    "starting_equipment"
  ],
  "type": "tool"
}
