{
  "@context": "https://troika-system-json.cheeleong.dev/context.jsonld",
  "@id": "https://troika-system-json.cheeleong.dev/objects/items/club.json",
  "@type": "Item",
  "name": "Club",
  "description": "A simple wooden weapon, crude but effective.",
  "slots": 1,
  "tags": [
    "weapon",
    "melee",
    "simple"
  ],
  "weapon": {
    "category": "melee",
    "damageAs": "club",
    "specialRules": [
      "one_handed",
      "melee"
    ]
  },
  "type": "weapon"
}
