{
  "@context": "https://troika-system-json.cheeleong.dev/context.jsonld",
  "@id": "https://troika-system-json.cheeleong.dev/objects/items/bow.json",
  "@type": "Item",
  "name": "Bow",
  "description": "A traditional ranged weapon that fires arrows.",
  "slots": 2,
  "tags": [
    "weapon",
    "ranged",
    "traditional"
  ],
  "weapon": {
    "category": "ranged",
    "damageAs": "bow",
    "specialRules": [
      "two_handed",
      "ranged"
    ]
  },
  "type": "weapon"
}
