{
  "@context": "https://cheeleong.dev/troika-system-json/context.jsonld",
  "@id": "https://cheeleong.dev/troika-system-json/objects/items/witch-hair-rope.json",
  "@type": "Item",
  "name": "Witch-hair Rope",
  "description": "Witch-hair ropes are immune to manipulation via magical means.",
  "slots": 1,
  "value": "25 silver pence",
  "tags": [
    "tool",
    "magical"
  ],
  "type": "misc"
}
