{
  "@context": "https://cheeleong.dev/troika-system-json/context.jsonld",
  "@id": "https://cheeleong.dev/troika-system-json/objects/items/salt.json",
  "@type": "Item",
  "name": "Salt",
  "description": "Salt is the poor man's Silver. Where Silver kills the demonic and the dead Salt merely harms or bars.",
  "slots": 1,
  "value": "2 silver pence",
  "tags": [
    "consumable",
    "weapon",
    "supernatural"
  ],
  "type": "misc"
}
